{
  "kind": "survivor",
  "id": "sv.harman-brooks",
  "name": "Harman Brooks",
  "occupation": "Park Ranger",
  "stats": {
    "influence": 32,
    "attack": 3,
    "search": 3
  },
  "ability": {
    "id": "thickSkin",
    "kind": "passive",
    "effect": [
      {
        "op": "grant",
        "what": "frostbiteIsWound",
        "scope": {
          "who": "self"
        },
        "duration": "game"
      }
    ]
  },
  "coop": true,
  "text": {
    "ability": "Frostbite never takes hold of Harman: he takes an ordinary wound instead.",
    "bio": "Has weathered worse winters than this one, mostly alone."
  },
  "sources": {
    "stats.influence": "VASSAL v1.1 Survivor_Harman_Brooks.jpg",
    "stats.attack": "VASSAL v1.1 Survivor_Harman_Brooks.jpg",
    "stats.search": "VASSAL v1.1 Survivor_Harman_Brooks.jpg",
    "ability": "VASSAL v1.1 Survivor_Harman_Brooks.jpg"
  },
  "status": "verified",
  "notes": "Clean scan Survivor_Harman_Brooks.jpg matches influence, attack, search, ability location, die value and once-per-round limit."
}
