{
  "kind": "survivor",
  "id": "sv.carla-thompson",
  "name": "Carla Thompson",
  "occupation": "Police Dispatcher",
  "stats": {
    "influence": 22,
    "attack": 4,
    "search": 2
  },
  "ability": {
    "id": "keenEye",
    "kind": "triggered",
    "trigger": "search.drawn",
    "location": "loc.police-station",
    "limit": "oncePerRound",
    "optional": true,
    "effect": [
      {
        "op": "extraSearchLook",
        "count": 1
      },
      {
        "op": "extraSearchKeep",
        "count": 1
      }
    ]
  },
  "coop": true,
  "text": {
    "ability": "Once a round, a search at the Police Station lets Carla look at one more card and keep one more card.",
    "bio": "Spent years as a voice on the radio and can still direct everyone at once."
  },
  "sources": {
    "stats.influence": "VASSAL v1.1 Survivor_Carla_Thompson.jpg",
    "stats.attack": "VASSAL v1.1 Survivor_Carla_Thompson.jpg",
    "stats.search": "VASSAL v1.1 Survivor_Carla_Thompson.jpg",
    "ability": "VASSAL v1.1 Survivor_Carla_Thompson.jpg"
  },
  "status": "verified",
  "notes": "Clean scan Survivor_Carla_Thompson.jpg matches influence, attack, search, ability location, die value and once-per-round limit."
}
