{
  "kind": "survivor",
  "id": "sv.alexis-grey",
  "name": "Alexis Grey",
  "occupation": "Librarian",
  "stats": {
    "influence": 46,
    "attack": 5,
    "search": 4
  },
  "ability": {
    "id": "keenEye",
    "kind": "triggered",
    "trigger": "search.drawn",
    "location": "loc.library",
    "limit": "oncePerRound",
    "optional": true,
    "effect": [
      {
        "op": "extraSearchLook",
        "count": 1
      },
      {
        "op": "extraSearchKeep",
        "count": 1
      }
    ]
  },
  "coop": true,
  "text": {
    "ability": "Once a round, a search at the Library lets Alexis look at one more card and keep one more card.",
    "bio": "Spent her career among shelves and still reads a room faster than most people read a page."
  },
  "sources": {
    "stats.influence": "VASSAL v1.1 Survivor_Alexis_Grey.jpg",
    "stats.attack": "VASSAL v1.1 Survivor_Alexis_Grey.jpg",
    "stats.search": "VASSAL v1.1 Survivor_Alexis_Grey.jpg",
    "ability": "VASSAL v1.1 Survivor_Alexis_Grey.jpg"
  },
  "status": "verified",
  "notes": "Clean scan Survivor_Alexis_Grey.jpg matches influence, attack, search, ability location, die value and once-per-round limit."
}
