{
  "kind": "survivor",
  "id": "sv.sophie-robinson",
  "name": "Sophie Robinson",
  "occupation": "Pilot",
  "stats": {
    "influence": 58,
    "attack": 4,
    "search": 1
  },
  "ability": {
    "id": "aerialView",
    "kind": "action",
    "limit": "oncePerRound",
    "effect": [
      {
        "op": "peekDeck",
        "count": 1,
        "location": "chosen"
      }
    ]
  },
  "coop": true,
  "text": {
    "ability": "Once a round, Sophie peeks at the top card of any one location's item deck, then leaves it where it was.",
    "bio": "Used to seeing the whole map from above and plans routes accordingly."
  },
  "sources": {
    "stats.influence": "VASSAL v1.1 Survivor_Sophie_Robinson.jpg",
    "stats.attack": "VASSAL v1.1 Survivor_Sophie_Robinson.jpg",
    "stats.search": "VASSAL v1.1 Survivor_Sophie_Robinson.jpg",
    "ability": "VASSAL v1.1 Survivor_Sophie_Robinson.jpg"
  },
  "status": "verified",
  "notes": "Clean scan Survivor_Sophie_Robinson.jpg matches influence, attack, search, ability location, die value and once-per-round limit."
}
