{
  "kind": "survivor",
  "id": "sv.sparky",
  "name": "Sparky",
  "occupation": "Stunt Dog",
  "stats": {
    "influence": 10,
    "attack": 2,
    "search": 2
  },
  "ability": {
    "id": "goodBoy",
    "kind": "passive",
    "effect": [
      {
        "op": "grant",
        "what": "biteIsWound",
        "scope": {
          "who": "self"
        },
        "duration": "game"
      },
      {
        "code": "survivor.sparky.skipBiteSpread"
      }
    ]
  },
  "coop": true,
  "text": {
    "ability": "A bite on Sparky's exposure roll is only a wound, and a spreading bite passes him by.",
    "bio": "Small, fearless, tough as old boots, and answers to treats."
  },
  "sources": {
    "stats.influence": "VASSAL v1.1 Survivor_Sparky.jpg",
    "stats.attack": "VASSAL v1.1 Survivor_Sparky.jpg",
    "stats.search": "VASSAL v1.1 Survivor_Sparky.jpg",
    "ability": "VASSAL v1.1 Survivor_Sparky.jpg"
  },
  "status": "verified",
  "notes": "Clean scan Survivor_Sparky.jpg matches influence, attack, search, ability location, die value and once-per-round limit."
}
