{
  "kind": "survivor",
  "id": "sv.maria-lopez",
  "name": "Maria Lopez",
  "occupation": "Teacher",
  "stats": {
    "influence": 48,
    "attack": 4,
    "search": 2
  },
  "ability": {
    "id": "lessonLearned",
    "kind": "action",
    "location": "loc.school",
    "cost": {
      "die": 1
    },
    "limit": "oncePerRound",
    "when": {
      "test": "zombiesAtLeast",
      "subject": "location",
      "value": 1
    },
    "effect": [
      {
        "op": "killZombies",
        "count": 1,
        "location": "here",
        "value": "noExposure"
      }
    ]
  },
  "coop": true,
  "text": {
    "ability": "(1+) Once a round at the School, Maria drops one zombie without a roll for exposure.",
    "bio": "Has defended a classroom before and is not about to lose this one."
  },
  "sources": {
    "stats.influence": "VASSAL v1.1 Survivor_Maria_Lopez.jpg",
    "stats.attack": "VASSAL v1.1 Survivor_Maria_Lopez.jpg",
    "stats.search": "VASSAL v1.1 Survivor_Maria_Lopez.jpg",
    "ability": "VASSAL v1.1 Survivor_Maria_Lopez.jpg"
  },
  "status": "verified",
  "notes": "Clean scan Survivor_Maria_Lopez.jpg matches influence, attack, search, ability location, die value and once-per-round limit."
}
