{
  "kind": "survivor",
  "id": "sv.gabriel-diaz",
  "name": "Gabriel Diaz",
  "occupation": "Fireman",
  "stats": {
    "influence": 60,
    "attack": 2,
    "search": 3
  },
  "ability": {
    "id": "sweep",
    "kind": "action",
    "location": "nonColony",
    "limit": "oncePerRound",
    "effect": [
      {
        "op": "revealDeck",
        "value": 4,
        "location": "here"
      },
      {
        "op": "draw",
        "value": "revealed",
        "symbol": "survivor",
        "count": 1,
        "optional": true,
        "scope": {
          "who": "chosen",
          "chooser": "owner"
        }
      },
      {
        "op": "shuffleDeck",
        "location": "here"
      }
    ]
  },
  "coop": true,
  "text": {
    "ability": "Four cards off the top of the local deck, one Outsider kept if Gabriel likes the look of them, the rest shuffled back in. Not at the colony; once a round.",
    "bio": "Goes through the door everyone else is running from."
  },
  "sources": {
    "stats.influence": "VASSAL v1.1 Survivor_Gabriel_Diaz.jpg",
    "stats.attack": "VASSAL v1.1 Survivor_Gabriel_Diaz.jpg",
    "stats.search": "VASSAL v1.1 Survivor_Gabriel_Diaz.jpg",
    "ability": "VASSAL v1.1 Survivor_Gabriel_Diaz.jpg"
  },
  "status": "verified",
  "notes": "Clean scan Survivor_Gabriel_Diaz.jpg matches influence, attack, search, ability location, die value and once-per-round limit."
}
