{
  "kind": "survivor",
  "id": "sv.brian-lee",
  "name": "Brian Lee",
  "occupation": "Mayor",
  "stats": {
    "influence": 68,
    "attack": 3,
    "search": 4
  },
  "ability": {
    "id": "rally",
    "kind": "action",
    "limit": "oncePerRound",
    "effect": [
      {
        "op": "modDie",
        "value": 1,
        "count": 1,
        "scope": {
          "who": "seat"
        }
      }
    ]
  },
  "coop": true,
  "text": {
    "ability": "Once a round Brian raises one of your unused action dice by 1.",
    "bio": "Knows how to keep a crowd calm and a rumor from spreading."
  },
  "sources": {
    "stats.influence": "VASSAL v1.1 Survivor_Brian_Lee.jpg",
    "stats.attack": "VASSAL v1.1 Survivor_Brian_Lee.jpg",
    "stats.search": "VASSAL v1.1 Survivor_Brian_Lee.jpg",
    "ability": "VASSAL v1.1 Survivor_Brian_Lee.jpg"
  },
  "status": "verified",
  "notes": "Clean scan Survivor_Brian_Lee.jpg matches influence, attack, search, ability location, die value and once-per-round limit."
}
