{
  "kind": "survivor",
  "id": "sv.gray-beard",
  "name": "Gray Beard",
  "occupation": "Pirate",
  "stats": {
    "influence": 16,
    "attack": 1,
    "search": 4
  },
  "ability": {
    "id": "plunder",
    "kind": "action",
    "location": "colony",
    "limit": "oncePerRound",
    "effect": [
      {
        "op": "stealCard",
        "count": 1,
        "scope": {
          "who": "chosen",
          "chooser": "owner",
          "filter": {
            "test": "handAtLeast",
            "subject": "seat",
            "value": 1
          }
        }
      }
    ]
  },
  "coop": false,
  "text": {
    "ability": "Once a round at the colony, Gray Beard takes one random card from another player's hand. Not used in the co-op variant.",
    "bio": "Treats other people's belongings as an opening offer."
  },
  "sources": {
    "stats.influence": "VASSAL v1.1 Survivor_Gray_Beard.jpg",
    "stats.attack": "VASSAL v1.1 Survivor_Gray_Beard.jpg",
    "stats.search": "VASSAL v1.1 Survivor_Gray_Beard.jpg",
    "ability": "VASSAL v1.1 Survivor_Gray_Beard.jpg"
  },
  "status": "verified",
  "notes": "Clean scan Survivor_Gray_Beard.jpg matches influence, attack, search, ability location, die value and once-per-round limit. The Vassal module files him with the promos; kept because our 30-survivor roster carries him. The scan carries the not-in-co-op marker."
}
