{
  "kind": "survivor",
  "id": "sv.ashley-ross",
  "name": "Ashley Ross",
  "occupation": "Construction Worker",
  "stats": {
    "influence": 52,
    "attack": 2,
    "search": 5
  },
  "ability": {
    "id": "quickBuild",
    "kind": "action",
    "limit": "oncePerRound",
    "countsAs": "barricade",
    "effect": [
      {
        "op": "addBarricade",
        "count": 1,
        "location": "here"
      }
    ]
  },
  "coop": true,
  "text": {
    "ability": "Once a round Ashley puts up a barricade without spending a die.",
    "bio": "Can frame a wall in minutes and trusts nothing she did not nail down herself."
  },
  "sources": {
    "stats.influence": "VASSAL v1.1 Survivor_Ashley_Ross.jpg",
    "stats.attack": "VASSAL v1.1 Survivor_Ashley_Ross.jpg",
    "stats.search": "VASSAL v1.1 Survivor_Ashley_Ross.jpg",
    "ability": "VASSAL v1.1 Survivor_Ashley_Ross.jpg"
  },
  "status": "verified",
  "notes": "Clean scan Survivor_Ashley_Ross.jpg matches influence, attack, search, ability location, die value and once-per-round limit."
}
